{
  "version": "1",
  "complete": true,
  "nodes": [
    {
      "id": "us:US-01",
      "kind": "us",
      "revision": "1",
      "source": "us/US-01.md"
    },
    {
      "id": "ac:US-01.AC-01",
      "kind": "ac",
      "revision": "1",
      "source": "us/US-01.md"
    }
  ],
  "edges": [
    {
      "from": "us:US-01",
      "to": "ac:US-01.AC-01",
      "relation": "derives",
      "source": "us/US-01.md",
      "revision": "1"
    }
  ]
}
